{"created_at":"2026-09-06T12:31:28Z","extractor":{"bytes_sha256":"sha256:b329da52e61e2a4cb5993b9a495b91d1b5e9fce2365bf617780f7c19e2b3c938","path":"testdata/cohesion/go-official-downloads-extractor.go","source_revision":"ff3b93ff240d66453155ae1a161b1b792ee61cde"},"findings":[],"oracle":{"bytes_sha256":"sha256:1951374dfba617289ba4631eedd8f106a1cd0a7e34c5be58a8505a61db9e90f4","path":"testdata/cohesion/go-official-downloads-oracle.json","source_revision":"ff3b93ff240d66453155ae1a161b1b792ee61cde"},"outcome":"accepted-no-findings","reviewer_id":"go-official-downloads-oracle-independent-acceptance-review","schema_id":"urn:golib:cohesion:go-official-downloads-oracle-review:v1","schema_version":1}